#tax_id,GeneID,Symbol,LocusTag,Synonyms,dbXrefs,chromosome,map_location,description,type_of_gene,Symbol_from_nomenclature_authority,Full_name_from_nomenclature_authority,Nomenclature_status,Other_designations,Modification_date,Feature_type
1464074,37618286,E7,D1R47_gp2,-,-,-,-,putative E7 oncogenic protein,protein-coding,-,-,-,putative E7 oncogenic protein,20181103,-
1464074,37618287,E1,D1R47_gp3,-,-,-,-,putative early E1 protein,protein-coding,-,-,-,putative early E1 protein,20181103,-
1464074,37618288,E2,D1R47_gp4,-,-,-,-,putative E2 early protein,protein-coding,-,-,-,putative E2 early protein,20181103,-
1464074,37618289,L2,D1R47_gp5,-,-,-,-,putative late L2 protein,protein-coding,-,-,-,putative late L2 protein,20181103,-
1464074,37618290,L1,D1R47_gp6,-,-,-,-,putative late L1 protein,protein-coding,-,-,-,putative late L1 protein,20181103,-
1464074,37618291,E6,D1R47_gp1,-,-,-,-,putative E6 oncogenic protein,protein-coding,-,-,-,putative E6 oncogenic protein,20181103,-
1464074,37630252,NEWENTRY,-,-,-,-,-,Record to support submission of GeneRIFs for a gene not in Gene (Rhinolophus ferrumequinum papillomavirus type 1).,other,-,-,-,-,20200506,-
