#tax_id,GeneID,Symbol,LocusTag,Synonyms,dbXrefs,chromosome,map_location,description,type_of_gene,Symbol_from_nomenclature_authority,Full_name_from_nomenclature_authority,Nomenclature_status,Other_designations,Modification_date,Feature_type
1569052,26796190,AXI84_gp2,AXI84_gp2,-,-,-,-,triple gene block protein 1,protein-coding,-,-,-,triple gene block protein 1,20180816,-
1569052,26796191,AXI84_gp3,AXI84_gp3,-,-,-,-,triple gene block protein 2,protein-coding,-,-,-,triple gene block protein 2,20180816,-
1569052,26796192,AXI84_gp4,AXI84_gp4,-,-,-,-,triple gene block protein 3,protein-coding,-,-,-,triple gene block protein 3,20180816,-
1569052,26796193,AXI84_gp5,AXI84_gp5,-,-,-,-,coat protein,protein-coding,-,-,-,coat protein,20180816,-
1569052,26796194,AXI84_gp6,AXI84_gp6,-,-,-,-,nucleic acid binding protein,protein-coding,-,-,-,nucleic acid binding protein,20180816,-
1569052,26796195,AXI84_gp1,AXI84_gp1,-,-,-,-,replicase polyprotein,protein-coding,-,-,-,replicase polyprotein,20180816,-
1569052,26823848,NEWENTRY,-,-,-,-,-,Record to support submission of GeneRIFs for a gene not in Gene.,other,-,-,-,-,20200516,-
