#tax_id,GeneID,Symbol,LocusTag,Synonyms,dbXrefs,chromosome,map_location,description,type_of_gene,Symbol_from_nomenclature_authority,Full_name_from_nomenclature_authority,Nomenclature_status,Other_designations,Modification_date,Feature_type
1776153,27963662,A9272_gp2,A9272_gp2,-,-,-,-,putative nonstructural protein NS1,protein-coding,-,-,-,putative nonstructural protein NS1,20180817,-
1776153,27963663,A9272_gp3,A9272_gp3,-,-,-,-,putative structural protein,protein-coding,-,-,-,putative structural protein,20180817,-
1776153,27963664,A9272_gp4,A9272_gp4,-,-,-,-,putative structural protein VP1,protein-coding,-,-,-,putative structural protein VP1,20180817,-
1776153,27963665,A9272_gp1,A9272_gp1,-,-,-,-,putative nonstructural protein,protein-coding,-,-,-,putative nonstructural protein,20180817,-
1776153,27981857,NEWENTRY,-,-,-,-,-,Record to support submission of GeneRIFs for a gene not in Gene.,other,-,-,-,-,20210505,-
