#tax_id,GeneID,Symbol,LocusTag,Synonyms,dbXrefs,chromosome,map_location,description,type_of_gene,Symbol_from_nomenclature_authority,Full_name_from_nomenclature_authority,Nomenclature_status,Other_designations,Modification_date,Feature_type
1809767,27111908,A3Q44_gp2,A3Q44_gp2,-,-,-,-,putative fusion protein P1-P2,protein-coding,-,-,-,putative fusion protein P1-P2,20180817,-
1809767,27111909,A3Q44_gp3,A3Q44_gp3,-,-,-,-,putative protein P1,protein-coding,-,-,-,putative protein P1,20180817,-
1809767,27111910,A3Q44_gp4,A3Q44_gp4,-,-,-,-,putative read-through protein P5,protein-coding,-,-,-,putative read-through protein P5,20180817,-
1809767,27111911,A3Q44_gp5,A3Q44_gp5,-,-,-,-,putative coat protein P3,protein-coding,-,-,-,putative coat protein P3,20180817,-
1809767,27111912,A3Q44_gp6,A3Q44_gp6,-,-,-,-,putative movement protein P4,protein-coding,-,-,-,putative movement protein P4,20180817,-
1809767,27111913,A3Q44_gp1,A3Q44_gp1,-,-,-,-,putative protein P0,protein-coding,-,-,-,putative protein P0,20180817,-
1809767,27209533,NEWENTRY,-,-,-,-,-,Record to support submission of GeneRIFs for a gene not in Gene.,other,-,-,-,-,20200516,-
