#tax_id,GeneID,Symbol,LocusTag,Synonyms,dbXrefs,chromosome,map_location,description,type_of_gene,Symbol_from_nomenclature_authority,Full_name_from_nomenclature_authority,Nomenclature_status,Other_designations,Modification_date,Feature_type
1891769,14438952,G304_gp5,G304_gp5,-,-,-,-,small T antigen,protein-coding,-,-,-,small T antigen,20180817,-
1891769,14438953,G304_gp4,G304_gp4,-,-,-,-,large T antigen,protein-coding,-,-,-,large T antigen,20180817,-
1891769,14438954,G304_gp3,G304_gp3,-,-,-,-,major structural protein VP1,protein-coding,-,-,-,major structural protein VP1,20180817,-
1891769,14438955,G304_gp2,G304_gp2,-,-,-,-,minor structural protein VP3,protein-coding,-,-,-,minor structural protein VP3,20180817,-
1891769,14438956,G304_gp1,G304_gp1,-,-,-,-,minor structural protein VP2,protein-coding,-,-,-,minor structural protein VP2,20180817,-
1891769,35290693,NEWENTRY,-,-,-,-,-,Record to support submission of GeneRIFs for a gene not in Gene.,other,-,-,-,-,20200506,-
