#tax_id,GeneID,Symbol,LocusTag,Synonyms,dbXrefs,chromosome,map_location,description,type_of_gene,Symbol_from_nomenclature_authority,Full_name_from_nomenclature_authority,Nomenclature_status,Other_designations,Modification_date,Feature_type
1980494,2943138,TULVsLgp1,TULVsLgp1,-,-,-,-,RNA polymerase (L protein),protein-coding,-,-,-,RNA polymerase (L protein),20180817,-
1980494,2943140,TULVsMgp1,TULVsMgp1,-,-,-,-,Glycoproteins G1 and G2 precursor,protein-coding,-,-,-,Glycoproteins G1 and G2 precursor,20180817,-
1980494,11293673,TULV_gp1,TULV_gp1,-,-,-,-,nucleocapsid protein,protein-coding,-,-,-,nucleocapsid protein,20200411,-
1980494,11293674,TULV_gp2,TULV_gp2,-,-,-,-,nonstructral protein,protein-coding,-,-,-,nonstructral protein,20180817,-
1980494,32283614,NEWENTRY,-,-,-,-,-,Record to support submission of GeneRIFs for a gene not in Gene (Tula hantavirus; Tula virus).,other,-,-,-,-,20200520,-
