#tax_id,GeneID,Symbol,LocusTag,Synonyms,dbXrefs,chromosome,map_location,description,type_of_gene,Symbol_from_nomenclature_authority,Full_name_from_nomenclature_authority,Nomenclature_status,Other_designations,Modification_date,Feature_type
255255,37616513,NABP,D1P51_gp6,-,-,-,-,nucleic acid binding protein,protein-coding,-,-,-,nucleic acid binding protein,20181103,-
255255,37616514,TGB1,D1P51_gp2,-,-,-,-,triple gene block protein 1,protein-coding,-,-,-,triple gene block protein 1,20181103,-
255255,37616515,TGB2,D1P51_gp3,-,-,-,-,triple gene block protein 2,protein-coding,-,-,-,triple gene block protein 2,20181103,-
255255,37616516,TGB3,D1P51_gp4,-,-,-,-,triple gene block protein 3,protein-coding,-,-,-,triple gene block protein 3,20180825,-
255255,37616517,CP,D1P51_gp5,-,-,-,-,coat protein,protein-coding,-,-,-,coat protein,20181103,-
255255,37616518,RdRp,D1P51_gp1,-,-,-,-,RNA-dependent RNA polymerase,protein-coding,-,-,-,RNA-dependent RNA polymerase,20181103,-
255255,37629736,NEWENTRY,-,-,-,-,-,Record to support submission of GeneRIFs for a gene not in Gene.,other,-,-,-,-,20200516,-
