#tax_id,GeneID,Symbol,LocusTag,Synonyms,dbXrefs,chromosome,map_location,description,type_of_gene,Symbol_from_nomenclature_authority,Full_name_from_nomenclature_authority,Nomenclature_status,Other_designations,Modification_date,Feature_type
592206,7412076,HHNV_gp2,HHNV_gp2,-,-,-,-,triple gene block protein 1,protein-coding,-,-,-,triple gene block protein 1,20180816,-
592206,7412077,HHNV_gp3,HHNV_gp3,-,-,-,-,triple gene block protein 2,protein-coding,-,-,-,triple gene block protein 2,20180816,-
592206,7412078,HHNV_gp4,HHNV_gp4,-,-,-,-,triple gene block protein 3,protein-coding,-,-,-,triple gene block protein 3,20180816,-
592206,7412079,HHNV_gp5,HHNV_gp5,-,-,-,-,capsid protein,protein-coding,-,-,-,capsid protein,20180816,-
592206,7412080,HHNV_gp6,HHNV_gp6,-,-,-,-,putative nucleic acid binding protein,protein-coding,-,-,-,putative nucleic acid binding protein,20180816,-
592206,7412081,HHNV_gp1,HHNV_gp1,-,-,-,-,putative replicase polyprotein,protein-coding,-,-,-,putative replicase polyprotein,20180816,-
592206,7439830,NEWENTRY,-,-,-,-,-,Record to support submission of GeneRIFs for a gene not in Gene.,other,-,-,-,-,20200516,-
